{
  "schema": "system_compiler.fact_evidence/v0",
  "source": "Examples/io/i2c_whoami_probe_smoke",
  "producer": "driver.i2c_whoami_probe",
  "summary": {
    "probe_count": 3,
    "success_count": 1,
    "failure_path_count": 2,
    "required_count": 6,
    "provided_count": 5,
    "missing_count": 1
  },
  "facts": {
    "declared_facts": [
      "i2c.device:i2c1@0x18",
      "i2c.evidence:whoami_probe"
    ],
    "required_facts": [
      "i2c.device:i2c1@0x18",
      "i2c.register:0x0f",
      "i2c.expected_id:0x33",
      "i2c.backend:io.device_i2c_mock",
      "i2c.evidence:whoami_probe",
      "i2c.probe.board_real"
    ],
    "audit_provided_facts": [
      "i2c.device:i2c1@0x18",
      "i2c.register:0x0f",
      "i2c.expected_id:0x33",
      "i2c.backend:io.device_i2c_mock",
      "i2c.evidence:whoami_probe"
    ]
  },
  "raw_facts": [
    {
      "name": "i2c.device:i2c1@0x18",
      "kind": "i2c.device",
      "source": "driver.i2c_whoami_probe",
      "role": "probe_target",
      "required": true,
      "state": "provided"
    },
    {
      "name": "i2c.register:0x0f",
      "kind": "i2c.register",
      "source": "driver.i2c_whoami_probe",
      "role": "probe_register",
      "required": true,
      "state": "provided"
    },
    {
      "name": "i2c.expected_id:0x33",
      "kind": "i2c.expected_id",
      "source": "driver.i2c_whoami_probe",
      "role": "probe_expectation",
      "required": true,
      "state": "provided"
    },
    {
      "name": "i2c.backend:io.device_i2c_mock",
      "kind": "i2c.backend",
      "source": "io.device_i2c_mock",
      "role": "no_hardware_backend",
      "required": true,
      "state": "provided"
    },
    {
      "name": "i2c.evidence:whoami_probe",
      "kind": "i2c.evidence",
      "source": "Examples/io/i2c_whoami_probe_smoke",
      "role": "no_hardware_probe_evidence",
      "required": true,
      "state": "provided"
    },
    {
      "name": "i2c.probe.board_real",
      "kind": "i2c.probe",
      "source": "board.bringup",
      "role": "real_board_probe_gap",
      "required": true,
      "state": "missing"
    }
  ]
}
