{
  "schema": "system_compiler.fact_evidence/v0",
  "source": "Examples/platform/board_i2c_fact_composition_smoke",
  "producer": "platform.board_facts+io.device_i2c_facts",
  "summary": {
    "required_count": 6,
    "provided_count": 8,
    "satisfied_count": 6,
    "missing_count": 0,
    "optional_unknown_count": 1,
    "source_count": 3
  },
  "facts": {
    "declared_facts": [
      "board.stm32_stub",
      "capability:hal.i2c1",
      "i2c.bus:i2c1",
      "i2c.device:i2c1@0x18"
    ],
    "required_facts": [
      "i2c.bus:i2c1",
      "i2c.device:i2c1@0x18",
      "i2c.controller:hal.i2c1",
      "clock.domain:rcc.i2c1",
      "pinmux:pb8/pb9.af4",
      "i2c.backend:io.device_i2c_hal"
    ],
    "audit_provided_facts": [
      "board.stm32_stub",
      "capability:hal.i2c1",
      "i2c.bus:i2c1",
      "i2c.device:i2c1@0x18",
      "i2c.controller:hal.i2c1",
      "clock.domain:rcc.i2c1",
      "pinmux:pb8/pb9.af4",
      "i2c.backend:io.device_i2c_hal"
    ]
  },
  "raw_facts": [
    {
      "name": "board.stm32_stub",
      "kind": "board",
      "source": "platform.board.stm32_stub",
      "role": "board_package",
      "required": false,
      "state": "provided"
    },
    {
      "name": "capability:hal.i2c1",
      "kind": "capability",
      "source": "platform.board.stm32_stub",
      "role": "board_package",
      "required": false,
      "state": "provided"
    },
    {
      "name": "i2c.bus:i2c1",
      "kind": "i2c.bus",
      "source": "io.device_i2c.contract",
      "role": "contract_required",
      "required": true,
      "state": "unknown"
    },
    {
      "name": "i2c.device:i2c1@0x18",
      "kind": "i2c.device",
      "source": "io.device_i2c.contract",
      "role": "contract_required",
      "required": true,
      "state": "unknown"
    },
    {
      "name": "i2c.controller:hal.i2c1",
      "kind": "i2c.controller",
      "source": "io.device_i2c.contract",
      "role": "contract_required",
      "required": true,
      "state": "unknown"
    },
    {
      "name": "clock.domain:rcc.i2c1",
      "kind": "clock.domain",
      "source": "io.device_i2c.contract",
      "role": "contract_required",
      "required": true,
      "state": "unknown"
    },
    {
      "name": "pinmux:pb8/pb9.af4",
      "kind": "pinmux",
      "source": "io.device_i2c.contract",
      "role": "contract_required",
      "required": true,
      "state": "unknown"
    },
    {
      "name": "i2c.backend:io.device_i2c_hal",
      "kind": "i2c.backend",
      "source": "io.device_i2c.contract",
      "role": "contract_required",
      "required": true,
      "state": "unknown"
    },
    {
      "name": "power.domain:sensor.vdd",
      "kind": "power.domain",
      "source": "io.device_i2c.contract",
      "role": "contract_optional",
      "required": false,
      "state": "unknown"
    },
    {
      "name": "i2c.bus:i2c1",
      "kind": "i2c.bus",
      "source": "platform.board.stm32_stub",
      "role": "board_package",
      "required": false,
      "state": "provided"
    },
    {
      "name": "i2c.device:i2c1@0x18",
      "kind": "i2c.device",
      "source": "platform.board.stm32_stub",
      "role": "board_package",
      "required": false,
      "state": "provided"
    },
    {
      "name": "i2c.controller:hal.i2c1",
      "kind": "i2c.controller",
      "source": "platform.board.stm32_stub",
      "role": "board_package",
      "required": false,
      "state": "provided"
    },
    {
      "name": "clock.domain:rcc.i2c1",
      "kind": "clock.domain",
      "source": "platform.board.stm32_stub",
      "role": "board_package",
      "required": false,
      "state": "provided"
    },
    {
      "name": "pinmux:pb8/pb9.af4",
      "kind": "pinmux",
      "source": "platform.board.stm32_stub",
      "role": "board_package",
      "required": false,
      "state": "provided"
    },
    {
      "name": "i2c.backend:io.device_i2c_hal",
      "kind": "i2c.backend",
      "source": "io.device_i2c_hal",
      "role": "adapter",
      "required": false,
      "state": "provided"
    }
  ]
}
