{
  "schema": "system_compiler.fact_evidence/v0",
  "source": "Examples/platform/board_facts_smoke",
  "producer": "platform.board_facts",
  "summary": {
    "required_count": 7,
    "provided_count": 7,
    "missing_count": 0,
    "optional_unknown_count": 1
  },
  "facts": {
    "declared_facts": [
      "board.stm32_stub",
      "capability:io.uart1",
      "capability:hal.uart1",
      "capability:io.console0",
      "clock.domain:system.clock",
      "capability:input.service",
      "capability:io.can0"
    ],
    "required_facts": [
      "board.stm32_stub",
      "capability:io.uart1",
      "capability:hal.uart1",
      "capability:io.console0",
      "clock.domain:system.clock",
      "capability:input.service",
      "capability:io.can0"
    ],
    "audit_provided_facts": [
      "board.stm32_stub",
      "capability:io.uart1",
      "capability:hal.uart1",
      "capability:io.console0",
      "clock.domain:system.clock",
      "capability:input.service",
      "capability:io.can0"
    ]
  },
  "raw_facts": [
    {
      "name": "board.stm32_stub",
      "kind": "board",
      "source": "platform.board.stm32_stub",
      "required": true,
      "state": "provided"
    },
    {
      "name": "capability:io.uart1",
      "kind": "capability",
      "source": "platform.board.stm32_stub",
      "required": true,
      "state": "provided"
    },
    {
      "name": "capability:hal.uart1",
      "kind": "capability",
      "source": "platform.board.stm32_stub",
      "required": true,
      "state": "provided"
    },
    {
      "name": "capability:io.console0",
      "kind": "capability",
      "source": "platform.board.stm32_stub",
      "required": true,
      "state": "provided"
    },
    {
      "name": "clock.domain:system.clock",
      "kind": "clock.domain",
      "source": "platform.board.stm32_stub",
      "required": true,
      "state": "provided"
    },
    {
      "name": "capability:input.service",
      "kind": "capability",
      "source": "platform.board.stm32_stub",
      "required": true,
      "state": "provided"
    },
    {
      "name": "capability:io.can0",
      "kind": "capability",
      "source": "platform.board.stm32_stub",
      "required": true,
      "state": "provided"
    },
    {
      "name": "storage:block.sd0",
      "kind": "storage",
      "source": "platform.board.stm32_stub",
      "required": false,
      "state": "unknown"
    }
  ]
}
